[
  {
    "name": "Dragonborn",
    "size": "medium",
    "speed": 30,
    "darkvision": 60,
    "traits": [
      {
        "name": "Draconic Ancestry",
        "description": "Your lineage stems from a dragon progenitor. Choose the kind of dragon from the Draconic Ancestors table. Your choice affects your Breath Weapon and Damage Resistance traits as well as your appearance. Dragon/Damage Type options: Black/Acid, Blue/Lightning, Brass/Fire, Bronze/Lightning, Copper/Acid, Gold/Fire, Green/Poison, Red/Fire, Silver/Cold, White/Cold."
      },
      {
        "name": "Breath Weapon",
        "description": "When you take the Attack action on your turn, you can replace one of your attacks with an exhalation of magical energy in either a 15-foot Cone or a 30-foot Line that is 5 feet wide (choose the shape each time). Each creature in that area must make a Dexterity saving throw (DC 8 plus your Constitution modifier and Proficiency Bonus). On a failed save, a creature takes 1d10 damage of the type determined by your Draconic Ancestry trait. On a successful save, a creature takes half as much damage. This damage increases by 1d10 when you reach character levels 5 (2d10), 11 (3d10), and 17 (4d10). You can use this Breath Weapon a number of times equal to your Proficiency Bonus, and you regain all expended uses when you finish a Long Rest."
      },
      {
        "name": "Damage Resistance",
        "description": "You have Resistance to the damage type determined by your Draconic Ancestry trait."
      },
      {
        "name": "Darkvision",
        "description": "You have Darkvision with a range of 60 feet."
      },
      {
        "name": "Draconic Flight",
        "description": "When you reach character level 5, you can channel draconic magic to give yourself temporary flight. As a Bonus Action, you sprout spectral wings on your back that last for 10 minutes or until you retract the wings (no action required) or have the Incapacitated condition. During that time, you have a Fly Speed equal to your Speed. Your wings appear to be made of the same energy as your Breath Weapon. Once you use this trait, you can't use it again until you finish a Long Rest."
      }
    ]
  },
  {
    "name": "Dwarf",
    "size": "medium",
    "speed": 30,
    "darkvision": 120,
    "traits": [
      {
        "name": "Darkvision",
        "description": "You have Darkvision with a range of 120 feet."
      },
      {
        "name": "Dwarven Resilience",
        "description": "You have Resistance to Poison damage. You also have Advantage on saving throws you make to avoid or end the Poisoned condition."
      },
      {
        "name": "Dwarven Toughness",
        "description": "Your Hit Point maximum increases by 1, and it increases by 1 again whenever you gain a level."
      },
      {
        "name": "Stonecunning",
        "description": "As a Bonus Action, you gain Tremorsense with a range of 60 feet for 10 minutes. You must be on a stone surface or touching a stone surface to use this Tremorsense. The stone can be natural or worked. You can use this Bonus Action a number of times equal to your Proficiency Bonus, and you regain all expended uses when you finish a Long Rest."
      }
    ]
  },
  {
    "name": "Elf",
    "size": "medium",
    "speed": 30,
    "darkvision": 60,
    "traits": [
      {
        "name": "Darkvision",
        "description": "You have Darkvision with a range of 60 feet."
      },
      {
        "name": "Elven Lineage",
        "description": "You are part of a lineage that grants you supernatural abilities. Choose a lineage from the Elven Lineages table. You gain the level 1 benefit of that lineage. When you reach character levels 3 and 5, you learn a higher-level spell, as shown on the table. You always have that spell prepared. You can cast it once without a spell slot, and you regain the ability to cast it in that way when you finish a Long Rest. You can also cast the spell using any spell slots you have of the appropriate level. Intelligence, Wisdom, or Charisma is your spellcasting ability for the spells you cast with this trait (choose the ability when you select the lineage). Lineage options — Drow: the range of your Darkvision increases to 120 feet and you know the Dancing Lights cantrip; level 3: Faerie Fire; level 5: Darkness. High Elf: you know the Prestidigitation cantrip and whenever you finish a Long Rest, you can replace that cantrip with a different cantrip from the Wizard spell list; level 3: Detect Magic; level 5: Misty Step. Wood Elf: your Speed increases to 35 feet and you know the Druidcraft cantrip; level 3: Longstrider; level 5: Pass without Trace."
      },
      {
        "name": "Fey Ancestry",
        "description": "You have Advantage on saving throws you make to avoid or end the Charmed condition."
      },
      {
        "name": "Keen Senses",
        "description": "You have proficiency in the Insight, Perception, or Survival skill."
      },
      {
        "name": "Trance",
        "description": "You don't need to sleep, and magic can't put you to sleep. You can finish a Long Rest in 4 hours if you spend those hours in a trancelike meditation, during which you retain consciousness."
      }
    ]
  },
  {
    "name": "Gnome",
    "size": "small",
    "speed": 30,
    "darkvision": 60,
    "traits": [
      {
        "name": "Darkvision",
        "description": "You have Darkvision with a range of 60 feet."
      },
      {
        "name": "Gnomish Cunning",
        "description": "You have Advantage on Intelligence, Wisdom, and Charisma saving throws."
      },
      {
        "name": "Gnomish Lineage",
        "description": "You are part of a lineage that grants you supernatural abilities. Choose one of the following options; whichever one you choose, Intelligence, Wisdom, or Charisma is your spellcasting ability for the spells you cast with this trait (choose the ability when you select the lineage). Forest Gnome: You know the Minor Illusion cantrip. You also always have the Speak with Animals spell prepared. You can cast it without a spell slot a number of times equal to your Proficiency Bonus, and you regain all expended uses when you finish a Long Rest. You can also use any spell slots you have to cast the spell. Rock Gnome: You know the Mending and Prestidigitation cantrips. In addition, you can spend 10 minutes casting Prestidigitation to create a Tiny clockwork device (AC 5, 1 HP), such as a toy, fire starter, or music box. When you create the device, you determine its function by choosing one effect from Prestidigitation; the device produces that effect whenever you or another creature takes a Bonus Action to activate it with a touch. If the chosen effect has options within it, you choose one of those options for the device when you create it. You can have three such devices in existence at a time, and each falls apart 8 hours after its creation or when you dismantle it with a touch as a Utilize action."
      }
    ]
  },
  {
    "name": "Goliath",
    "size": "medium",
    "speed": 35,
    "traits": [
      {
        "name": "Giant Ancestry",
        "description": "You are descended from Giants. Choose one of the following benefits—a supernatural boon from your ancestry; you can use the chosen benefit a number of times equal to your Proficiency Bonus, and you regain all expended uses when you finish a Long Rest. Cloud's Jaunt (Cloud Giant): As a Bonus Action, you magically teleport up to 30 feet to an unoccupied space you can see. Fire's Burn (Fire Giant): When you hit a target with an attack roll and deal damage to it, you can also deal 1d10 Fire damage to that target. Frost's Chill (Frost Giant): When you hit a target with an attack roll and deal damage to it, you can also deal 1d6 Cold damage to that target and reduce its Speed by 10 feet until the start of your next turn. Hill's Tumble (Hill Giant): When you hit a Large or smaller creature with an attack roll and deal damage to it, you can give that target the Prone condition. Stone's Endurance (Stone Giant): When you take damage, you can take a Reaction to roll 1d12. Add your Constitution modifier to the number rolled and reduce the damage by that total. Storm's Thunder (Storm Giant): When you take damage from a creature within 60 feet of you, you can take a Reaction to deal 1d8 Thunder damage to that creature."
      },
      {
        "name": "Large Form",
        "description": "Starting at character level 5, you can change your size to Large as a Bonus Action if you're in a big enough space. This transformation lasts for 10 minutes or until you end it (no action required). For that duration, you have Advantage on Strength checks, and your Speed increases by 10 feet. Once you use this trait, you can't use it again until you finish a Long Rest."
      },
      {
        "name": "Powerful Build",
        "description": "You have Advantage on any ability check you make to end the Grappled condition. You also count as one size larger when determining your carrying capacity."
      }
    ]
  },
  {
    "name": "Halfling",
    "size": "small",
    "speed": 30,
    "traits": [
      {
        "name": "Brave",
        "description": "You have Advantage on saving throws you make to avoid or end the Frightened condition."
      },
      {
        "name": "Halfling Nimbleness",
        "description": "You can move through the space of any creature that is a size larger than you, but you can't stop in the same space."
      },
      {
        "name": "Luck",
        "description": "When you roll a 1 on the d20 of a D20 Test, you can reroll the die, and you must use the new roll."
      },
      {
        "name": "Naturally Stealthy",
        "description": "You can take the Hide action even when you are obscured only by a creature that is at least one size larger than you."
      }
    ]
  },
  {
    "name": "Human",
    "size": "medium",
    "speed": 30,
    "traits": [
      {